{
  "$schema": "http://json-schema.org/draft-07/schema#",
  "$id": "https://idpf-praxis/.claude/metadata/scope-drift-protected-paths.schema.json",
  "title": "Scope-Drift Protected Paths",
  "description": "Always-protected paths checked by .claude/scripts/shared/scope-drift-check.js. Touching one of these paths during a /work sub-issue requires the issue body to name it explicitly (or a Scope-Override: line). Schema-driven so CI catches drift between the file and the consumer.",
  "type": "object",
  "additionalProperties": false,
  "required": ["version", "description", "paths"],
  "properties": {
    "$schema": {
      "type": "string"
    },
    "version": {
      "type": "integer",
      "minimum": 1,
      "description": "Schema version of this metadata file. Bump on breaking shape changes."
    },
    "description": {
      "type": "string",
      "minLength": 1
    },
    "paths": {
      "type": "array",
      "minItems": 1,
      "items": {
        "type": "object",
        "additionalProperties": false,
        "required": ["pattern", "reason"],
        "properties": {
          "pattern": {
            "type": "string",
            "minLength": 1,
            "description": "Glob pattern (minimatch syntax) matched against repo-relative paths. Use '**' for recursive directories."
          },
          "reason": {
            "type": "string",
            "minLength": 1,
            "description": "Why this path is protected. Surfaced to the user when the gate halts."
          }
        }
      }
    },
    "registrarExemption": {
      "type": "object",
      "additionalProperties": false,
      "required": ["description", "triggerPatterns", "exemptPatterns", "reason"],
      "description": "Exempts the paths /work Step 4e's register-helper.js necessarily edits from the always-protected halt (#2788), but ONLY on a run carrying the registrar's full signature. Optional: an absent block exempts nothing, which is the strict direction — absence must never widen a gate.",
      "properties": {
        "description": {
          "type": "string",
          "minLength": 1
        },
        "triggerPatterns": {
          "type": "array",
          "minItems": 2,
          "items": { "type": "string", "minLength": 1 },
          "description": "Glob patterns identifying a registrar run. EVERY pattern must match at least one touched path before any exemptPattern applies. minItems is 2 deliberately: a single pattern cannot express a co-occurrence signature, and any one of these patterns alone describes ordinary work."
        },
        "exemptPatterns": {
          "type": "array",
          "minItems": 1,
          "items": { "type": "string", "minLength": 1 },
          "description": "Always-protected paths exempt from the halt on a registrar run. Still reported, and still raise advisory outside-declared-scope violations."
        },
        "reason": {
          "type": "string",
          "minLength": 1,
          "description": "Why these paths are exempt. Surfaced in the gate report."
        }
      }
    }
  }
}
